Company/Brand,Sector,Stage,Amount($),HeadQuarter,What it does,Year,Founded,Founders,Investor,Subsector
SMOOR,Food and Beverages,,Undisclosed,Bangalore,Instigate your sixth sense with our new range of chocolates.,2021,2008.0,Vimal Sharma,Klub,
Pankhuri,Social community,,3200000,Bangalore,"Pankhuri is a women's only community for members to socialize, explore and upskill through live interactive courses, expert chat and interest-based clubs.",2021,2019.0,Pankhuri Shrivastava,Sequoia’s Surge,
Arcana,InfoTech & Services,Seed,370000,Bangalore,Arcana is the Storage Layer of Ethereum.,2021,2019.0,"Mayur Relekar, Aravindh Kumar, Abhishek Chaudhary",Balaji Srinivasan,
UrbanKisaan,Food and Beverages,,Undisclosed,Hyderabad,A modern farms close to where your home is. Creating positive change at every step from seed to store ensuring quality and traceability.,2021,2017.0,"Srinivas Chaganti, Vihari Kanukollu, Sairam Reddy",BASF Venture Capital GmbH,
Aquaconnect,Fishery,Pre-series A,4000000,Chennai,Aquaconnect is a global full-stack aquaculture technology venture that provides data-driven farm advisory and marketplace solutions to fish and shrimp farmers,2021,2017.0,Rajamanohar,"Rebright Partners, Flourish Ventures",
Vah Vah!,EdTech,,1800000,Bangalore,A mission to educate India and make its young and dynamic population job ready.,2021,2020.0,"Shailesh Daxini, Akash Senapaty, Muthukaleeshwaran Subbiah",Sequoia Capital India,
LetsDressUp,Fashion,Pre-series A,300000,Gurugram,Building India's version of Stitch Fix,2021,2019.0,Aditya B,"Titan Capital, Sequoia Capital",
Sapio Analytics,Tech,,150000,Mumbai,Aim to provide the most intelligent AI-powered policy making solutions for government institutions across the world.,2021,2019.0,"Ashwin Srivastava, Hardik Somani, Prashant Nikam",Parthiv Group,
Indi Energy,Renewables & Environment,Seed,Undisclosed,Roorkee,"Indi Energy is an energy storage startup involved in R&D of next generation battery technologies, with superior performance than current counterparts.",2021,2019.0,Dr. ASIT SAHOO,Mumbai Angels Network,
The Ayurveda Co,Consumer Goods,,Undisclosed,Gurugram,The Ayurveda Co. represents things that are all Ayurvedic at heart and are suited for the contemporary landscape.,2021,2021.0,"Param Bhargava, Shreedha Singh","GetVantage, Velocity, Shiprocket Capital",
Pratilipi,Online storytelling,,48000000,Bangalore,"Pratilipi is the largest Indian language self-publishing platform with over 350,000 authors and more than 28,000,000 unique monthly readers.",2021,2015.0,Ranjeet Pratap Singh,"Krafton Inc, Omidyar",
Ati Motors,Automotive,Pre-series A,35000000,Bangalore,Autonomous industrial vehicle maker,2021,2017.0,"Saurabh Chandra, Saad Nasser","Blume Ventures, Exfinity Venture Partners",
peAR,Deeptech,Pre-series A,300000,Mumbai,An AR / VR tech based Start-up in Mumbai.,2021,2018.0,"Dharmin Vora, Dhruvesh Mehta, Parth Vora",Inflection Point Ventures,
Gourmet Garden,Farming,,3000000,Bangalore,"100% contamination free, pesticide free naturoponically grown vegetables.",2021,2019.0,Arjun Balaji,"Beyond Next Ventures, M Venture Partners",
The Sleep Company,Consumer Goods,Pre-series A,1000000,Mumbai,Patent Pending sleep technology developed by actual Rocket Scientists and sleep experts after years of research.,2021,2019.0,,Fireside Ventures,
TyrePlex,B2B E-commerce,Seed,Undisclosed,Delhi,Tyreplex is digitizing the tyre dealers in India.,2021,2020.0,"Puneet Bhaskar, Rupendra Pratap Singh",AdvantEdge Founders,
ION Energy,Automotive,Pre-series A,3600000,Mumbai,Advanced Electronics & Software Supplier for Electric Vehicles & Battery Energy Storage,2021,2016.0,Akhil Aryan,,
Digit Insurance,Insuretech,,200000000,Bangalore,"Digit becomes the first Unicorn of 2021, valued at $1.9B.",2021,2016.0,Kamesh Goyal,"Faering Capital, Sequoia Capital India, IIFL Alternate Asset Managers",
FRAAZO,Food and Beverages,Series A,11000000,Mumbai,FRAAZO is Mumbai's favourite App for Fresh Vegetables and Fruits coming straight from the Farm to your Doorstep within 18 Hours.,2021,2020.0,"Atul Kumar, Aashish Krishnatre","Sixth Sense Ventures, NABVENTURES",
Licious,Food and Beverages,Series F,192000000,Bangalore,"Licious is a consumer food company, focussed at delighting the world with an unmatched range of meat & meat products.",2021,2015.0,"Abhay Hanjura, Vivek Gupta","Temasek, Multiples PE",
WinZO,Gaming,Series C,65000000,Delhi,WinZO is the largest social gaming and entertainment platform in India.,2021,2018.0,Paavan Nanda,Griffin Gaming Partners,
Furlenco,Consumer Goods,,100000000,Bangalore,Furlenco is a different furniture company.,2021,2012.0,Ajith Mohan Karimpana,Zinnia Global,
Skylark Drones,Aviation,Pre-series A,3000000,Bangalore,"Enterprise drone solutions that help plan, build, and sustain the world we live in.",2021,2014.0,Mughilan Thiru Ramasamy,"InfoEdge Ventures, IAN Fund",
Leegality,IT company,Pre-series A,Undisclosed,Gurugram,"The market standard for eSign, eStamp and Document Workflow in India. Eliminating paper from paperwork since 2016",2021,2016.0,Shivam Singla,"IIFL, Mumbai Angels",
Arcatron Mobility,HealthTech,,Undisclosed,Pune,Mission is to advance global standards of assisted living and make it dignified and safer.,2021,2015.0,Ganesh Sonawane,Klub,
TWID,FinTech,,2500000,Bangalore,"TWID is shaping the future of Digital Currencies, delivering new-age fintech solutions",2021,2020.0,"Amit Sharma, Amit Koshal, Rishi Batra","BEENEXT, Sequoia’s Surge",
PeakPerformer,EdTech,Early seed,Undisclosed,Bangalore,"A goal-oriented, outcome-driven platform to make leadership coaching accessible to all.",2021,2020.0,"Aishwarya Goel, Gaurav Jhunjhnuwala",Antler India,
MyMobiForce,Tech,Pre-series A,1400000,Noida,"Crowdsourcing platform imparting best-in-class services with immensely talented, skilled & qualified workforce pan-India",2021,2018.0,"Dheeraj Khatter, Himanshu Kumar, Kshitiz Saini",Bharat Inclusion,
Pine Labs,InfoTech & Services,,600000,Noida,A merchant platform company that provides financing and last-mile retail transaction technology to merchants,2021,1998.0,Amrish Rau,"Fidelity, BlackRock",
Genworks Health,HealthTech,,2000000,Bangalore,GENWORKS Health is an initiative by GE for empowering healthcare professionals operating in the rural areas to deliver better medical facilities and diagnostics while keeping things affordable.,2021,2015.0,S Ganeshprasad,Blacksoil,
Pocketly,FinTech,,Undisclosed,Bangalore,"Pocketly provides quick cash on hand, anytime - anywhere!",2021,2019.0,"Aarav Bhatia, Navdeesh Ahuja",,
Neverinstall,InfoTech & Services,Seed,370000,Bangalore,A cloud platform to bring any GUI application regardless of OS and Device type to the browser.,2021,2019.0,"Lakshmana Pasala, Ram Pasala",Speciale Invest,
CoRover,InfoTech & Services,,Undisclosed,Bangalore,CoRover is the world’s first and the highest ROI delivering human-centric conversational AI platform.,2021,2016.0,"Ankush Sabharwal, Manav Gandotra, Kunal Bhakhri",Canbank Venture Capital Fund,
BeatO,HealthTech,Pre-series B,5000000,Delhi,ULTIMATE app to manage chronic conditions.,2021,2015.0,Gautam Chopra,W Health Ventures,
Earth Rhythm,Consumer Goods,Seed,1200000,Gurugram,A mission to make customers healthier and Earth a little greener.,2021,2020.0,Harini Sivakumar,Anicut Angel Fund,
Fountain9,Tech,Seed,1900000,Mumbai,"Fountain9 is a Y Combinator backed company, which offers predictive inventory planning and optimization software for e-commerce, DTC and retail companies.",2021,2019.0,"Niki Khokale, Rajas Lonkar","021 Capital, Y Combinator",
Rockclimber,Food and Beverages,,1000000,Bangalore,RockClimber is a new age beverage brand with a portfolio of alcoholic and non alcoholic drinks.,2021,2019.0,"Deepak Poduval, Hariprasad Shetty",Anand Prakash Sharma,
SpEd@home,EdTech,,300000,Mumbai,"Provide Remediation, Occupational Therapy, Speech Therapy and Socio-emotional coaching for children with Learning Disabilities like Dyslexia, Dysgraphia, Dyscalculia",2021,2020.0,Dhaval Mody,,
CanPe,Tech,Seed,Undisclosed,Bangalore,"Digital-first debt collections platform that is driven by compassion, and powered by AI.",2021,2019.0,Arindam Choudhury,Axilor Ventures,
Green Soul,Consumer Goods,,200000,Ambernath,Green Soul is No.1 brand on Amazon India in Ergonomic chairs category in terms of customer reviews.,2021,2016.0,Ravi Khushwani,velocity.in,
Shiprocket,Logistics,Series D,41000000,Delhi,India's #1 eCommerce Logistics and Shipping Solution Empowering over 1 Lakh Indian eCommerce Sellers.,2021,2012.0,"Saahil Goel, Akshay Ghulati","March Capital, Tribe Capital",
DealShare,Retail,,144000000,Bangalore,The next generation disruptive (social) e-commerce product for the masses.,2021,2018.0,"Rajat Shikhar, Vineet Rao, Sourjyendu Medda",Tiger Global,
Teachmint,EdTech,Pre-series B,20000000,Bangalore,Teachmint is an all-in-one education technology platform created specifically for the tutors of the digital age.,2021,2020.0,"Mihir Gupta, Payoj Jain, Divyansh Bordia, Anshuman Kumar",Learn Capital,
Vahak,Transportation,Pre-series A,5000000,Bangalore,Building India's Largest & Most Trusted Online Transport Marketplace & Directory,2021,2017.0,"Vikas Chandrawat, Karan Shaha",RTP Global,
goSTOPS,Hospitality,Pre-series A,1000000,Delhi,goSTOPS aims to be India’s biggest and most loved backpacker hostel brand.,2021,2014.0,"Pallavi Agarwal, Pankaj Parwanda","IAN, Yuj Ventures",
Codedamn,Tech,Pre-seed,Undisclosed,Delhi,Codedamn enables anyone to learn and practice real-world programming skills and become industry relevant through our learning paths.,2021,2020.0,Mehul Mohan,Antler India,
Biocraft Innovation Technology,Environmental service,Pre-seed,Undisclosed,Noida,Innovation startup developing bamboo resources of India to be used in industrial use by developing injection moulding granules,2021,2019.0,"Vibha Mittal, Anubhav Mittal",JITO Angel Network,
Powerplay,Construction,,5200000,Bangalore,Powerplay helps simplify end to end Construction and Architecture project management.,2021,2020.0,"Shubham Goyal, Lesh Dixit","Sequoia’s Surge, Accel Partners",
Accio Robotics,AI,,Undisclosed,Bangalore,Accio Robotics is involved in the designing and manufacturing of state-of-the-art Robotics Automation solutions.,2021,2020.0,"Tuhin Sharma, Pranav Srinivasan",Uday Sodhi,
Delhivery,Logistics,Series H,270000000,Gurugram,"Delhivery is a supply chain services company that provides transportation, warehousing, freight, and order fulfillment services.",2021,2011.0,"Bhavesh Manglani, Kapil Bharati, Mohit Tandon, Sahil Barua, Suraj Saharan","Fidelity, GIC",
Avishkaar,EdTech,Pre-series A,600000,Delhi,India's leading Ed-Tech startup spearheading the Maker Revolution in the sub-continent,2021,2014.0,"Rajeev Gaba, Tarun Bhalla",Auxano,
Jobsgaar,Job discovery platform,Seed,140000,Delhi,India's first District level/ Hyper Local Job discovery platform,2021,2020.0,Atul Pratap Singh,SucSEED Indovation Fund,
Almo,D2C Fashion,Seed,Undisclosed,Gurugram,Almo is a Premium Men's essentianls wear brand focused on bringing sophisticated yet functional designs to wardrobe.,2021,2020.0,Abhishek Shah,Angelist India,
Breathe Well-being,HealthTech,Pre-series A,1000000,Delhi,Breathe Wellbeing is an interactive and personalized platform that helps organization increase employee engagement and productivity.,2021,2015.0,"Aditya Kaicker, Rohan Verma","Stanford Angels and Entrepreneurs India, Anjali Bansal",
GalaxEye,SpaceTech,Pre-seed,Undisclosed,Chennai,GalaxEye enables businesses to make better Decisions & perform operations efficiently via Space Technology.,2021,2020.0,"Denil Chawda, Kishan Thakkar, Pranit Mehta, Satyanarayanan Chakravarthy, Suyash Singh",Speciale Invest,
Good Health Clinic,HealthTech,,5000000,Hyderabad,Full Stack Digital Health Clinic,2021,2021.0,Samarth Sindhi,Khosla Ventures,
Urban Company,Home services,Series F,250000000,Delhi,Urban Company is an India-based company providing a marketplace for freelance labor.,2021,2014.0,"Abhiraj Singh Bhal, Raghav Chandra, Varun Khaitan","Vy Capital, Wellington Management",
MYBYK,Rental,Pre-series A,1000000,Ahmedabad,MYBYK is an app that provides premium bicycle sharing and rental service.,2021,2014.0,Arjit Soni,Avon Cycles,
Locus,Logistics,Series C,50000000,Bangalore,Locus is an intelligent decision-making and automation platform for logistics.,2021,2015.0,"Geet Garg, Nishith Rastogi","Blume Ventures, Exfinity Venture Partners",
Crejo.Fun,EdTech,Seed,3000000,Bangalore,Crejo.Fun is a digital extracurricular learning platform being built with an intent to help children discover their passions and interests through creative learning.,2021,2020.0,Vikas Bansal,"Matrix Partners India, 021 Capital",
Bambinos,EdTech,Seed,500000,Bangalore,Cohort based extracurricular course for kids,2021,2020.0,"Ashish Gupta, Ankit Hetamsaria","HNIs, Angels",
KreditBee,FinTech,,8000000,Bangalore,KreditBee is a digital lending platform developed to assist young professionals with their personal finances.,2021,2018.0,"Karthikeyan Krishnaswamy, Madhusudan Ekambaram, Wan Hong","NewQuest Capital Partners, Motilal Oswal Private Equity",
Spardha,EdTech,Pre-series A,400000,Pune,"Spardha School Of Music, Spardha Academy, Spardha Online are associated marks with Spardha Learnings Private Limited.",2021,2016.0,"Saurabh Srivastav, Amrita Srivastav",Inflection Point Ventures,
Onelife Nutriscience,HealthTech,,Undisclosed,Mumbai,Onelife Nutriscience is a consumer healthcare brands company.,2021,2019.0,Gaurav Aggarwal,Lasons India,
Flatheads,Fashion,,Undisclosed,Bangalore,Flatheads is a lifestyle brand that designs and creates shoes from India for the world. Flatheads launched India's first bamboo footwear.,2021,2019.0,"Ganesh Balakrishnan, Utkarsh Biradar","Pankaj Chaddah, Srivatsan Rajan",
Fable Fintech,FinTech,Series A,Undisclosed,Mumbai,"Fable Fintech is being seed-funded by the CCAvenue Group, South East Asia’s number 1 eCommerce service provider",2021,2015.0,Naushad Contractor,Paytm,
Holisol,Logistics,,3000000,Delhi,HoliSol Logistics Is a Supply Chain Operations Company!,2021,2009.0,"Manish Ahuja, Naveen Rawat, Rahul Dogar","BlackSoil, CLSA Capital Partners",
Now&Me,HealthTech,,1000000,Delhi,"Now&Me is a safe cocoon in the form of discussion forums, for you to let out your most intimate thoughts.",2021,2018.0,"Bani Singh, Drishti Gupta","Saama, Whiteboard Capital",
Fyllo,AgriTech,Seed,400000,Bangalore,Fyllo brings farms on palms by installing on field devices and actions on top of this data.,2021,2019.0,"Sudhanshu Rai, Sumit Sheoran","Indian Angel Network, Titan Capital, Lead Angels",
Cora Health,HealthTech,,Undisclosed,Bangalore,Social Commerce Marketplace for health and wellness. Help people discover products suited to their health needs.,2021,2020.0,"Shrijit Venkatesh, Snigdha Kumar",,
Blaer Motors,Transportation,,300000,Chennai,Meant to augment human power and not completely replace it,2021,2014.0,Abinesh Ekambaram,The Chennai Angels,
Swiflearn,EdTech,Pre-series A,3000000,Gurugram,Swiflearn provides online tuition classes to small batches to ensure personalised learning.,2021,2019.0,"Abhinav Agarwal, Anand Bakode","Venture Highway, Stellaris Venture Partners",
Cashfree,FinTech,,Undisclosed,Bangalore,Cashfree is a payments and banking technology company that enables businesses in India to collect payments online and make payouts.,2021,2015.0,"Akash Sinha, Reeju Datta","State Bank of India, Y Combinator",
QuickSell,E-Commerce,Pre-series A,2000000,Mumbai,B2B Mobile Commerce Platform,2021,2017.0,Deepak Bhagchandani,"Sanjay Baldwa, Ajay Jain",
Truemeds,Heathcare,Series A,5000000,Mumbai,Truemeds is a health-tech startup.,2021,2019.0,"Akshat Nayyar, Kunal Wani",InfoEdge,
Candes,E-Commerce,,3000000,Delhi,Candes is a home appliances company providing a complete range of home & kitchen electrical appliances at affordable prices.,2021,2015.0,"Sandeep Aggarwal, Vipin Aggarwal","Nitin Passi, Ruchirans Jaipuria",
MediBuddy,Heathcare,,3000000,Bangalore,"MediBuddy is a digital healthcare platform for inpatient hospitalization, outpatient services, and corporate wellness benefits.",2021,2000.0,"Satish Kannan, Enbasekar","Stride Ventures, InnoVen Capital",
F5,Food and Beverages,Pre-series A,300000,Delhi,F5 is a foods and beverages company.,2021,2018.0,"Lalit Aggarwal, Raghav Arora","Venture Catalysts, Jeevak Gupta",
Capital Float,FinTech,,6000000,Bangalore,Capital Float is an online platform that provides working capital finance to SMEs in India.,2021,2013.0,"Gaurav Hinduja, Sashank Rishyasringa","Triodos Investment Management, SAIF Partners",
IntelleWings,IT startup,Seed,100000,Panchkula,"IntelleWings develops Sanctions & Anti-money laundering solutions with a clear, concise, and fresh perspective.",2021,2019.0,Pramod Sharma,,
Shyplite,Logistics,,1000000,Delhi,Enable E-retailers to automate their logistics and increase efficiency in shipments by providing a single window shipping platform,2021,2016.0,"Nisschal Jain,  Sugam Jain, Parinay Itkan",N+1 Capital,
Refyne,FinTech,Series A,20000000,Bangalore,Refyne partners with organisations to extend on-demand Earned Wage Access (EWA) to employees.,2021,2020.0,"Chitresh Sharma, Apoorv Kumar","DST Global, RTP Global",
Greenjoules,Renewable Energy,Series A,4500000,Pune,Greenjoules is a green energy technology startup that specializes in making renewable biofuels.,2021,2018.0,"R. Sethunath, V S Shridhar, V. Radhika, Viraraghavan Sankaran",Blue Ashva Capital,
MentorKart,Consulting,Seed,150000,Delhi,MentorKart™ helps to fulfil dreams and take that big step towards success.,2021,2018.0,"Ashish Khare, SK Mohanty","Amit Singal, Manish Aggarwal",
Leverage Edu,EdTech,Debt Financing,2000000,Delhi,AI-enabled marketplace designed to help students with their higher education and career growth plans,2021,2017.0,Akshay Chaturvedi,"Trifecta Capital Advisors, Blume Ventures",
Kale Logistics,Logistics,Series A,5000000,Thane,Kale Logistics Solutions is a global IT solutions provider focused on providing cutting-edge technology solutions to the Logistics industry.,2021,2010.0,"Amar More, Vipul Jain",Inflexor Ventures,
CustomerGlu,CRM,,320000,Bangalore,CustomerGlu is a Low code Interactive Engagement platform to improve user stickiness.,2021,2016.0,"Prateek Gupta, Raman Shrivastava, Sumant US","Kumar Aakash, Amit Singhal",
Cell Propulsion,EV startup,,2000000,Bangalore,Cell Propulsion is a fleet electrification company developing solutions for large scale electrification of commercial vehicle fleets.,2021,2016.0,"Nakul Kukar, Paras Kaushal",growX ventures,
Wellbeing Nutrition,HealthTech,,Undisclosed,Mumbai,Organic whole food nutrition to keep up with the pace at which we live,2021,2019.0,Avnish Chhabria,Klub,
Pee Safe,HealthTech,Pre-series B,3000000,Gurugram,Redcliffe Hygiene Private Limited is India's fastest growing hygiene company.,2021,2013.0,"Dheeraj Jain, Srijana Bagaria, Vikas Bagaria","Shaival Desai, Alkemi Venture Partners",
Chqbook,FinTech,,1000000,Delhi,"Chqbook is a fintech startup that allows customers to explore, compare, book and get personal finance products.",2021,2017.0,"Mohit Goel, Rajat Kumar, Sachin Arora, Vipul Sharma","Aavishkaar Venture Capital, YWC Venture Capital",
SimpliContract,Tech,Seed,1800000,Bangalore,"SimpliContract is an Enterprise SaaS offering, focused on end to end Contract Life-cycle Management.",2021,2020.0,"Guru Venkatesan, Jinaraj PG, Makesh Kumar",Kalaari Capital,
Dropshop,Logistics,Pre-series A,1000000,Bangalore,Building technology to make distribution efficient and cheaper for large and small FMCG companies,2021,2019.0,"Udit Dhawan, Rohit Fernandes, Ravi Teja",Inflection Point Ventures,
Jumbotail,E-Commerce,Debt Financing,4000000,Bangalore,Jumbotail is an operator of an online marketplace that simplifies food and grocery shopping.,2021,2015.0,"Ashish Jhina, Karthik Venkateswaran",Alteria Capital,
BYJU'S,EdTech,,350000000,Bangalore,BYJU'S is an educational technology company that develops personalized learning programs for K-12 students.,2021,2011.0,"Byju Raveendran, Divya Gokulnath","Tiga Investments, Baron Capital",
Power Gummies,Nutrition,,1000000,Delhi,Power Gummies are a team of passionate givers who are dedicated to catering nutritional supplements,2021,2018.0,Divij Bajaj,"Venture Catalysts, 9unicorns",
Convosight,Tech,Series A,9000000,Delhi,A mission - to help community builders become community entrepreneurs.,2021,2019.0,Tarun Dhamija,Qualgro,
Junio,FinTech,Seed,600000,Delhi,Junio is a kids-focused digital pocket money-smart card.,2021,2020.0,Ankit Gera,"Amit Lakhotia, Pravin Jadhav",
Wherehouse.io,Logistics,Seed,Undisclosed,Delhi,"Wherehouse.io is a supply chain intelligence company, helping brands to move closer to their customers enabling faster and better deliveries and accelerating business growth.",2021,2020.0,"Vaibhav Chawla, Jeevan Prakash, Lavelesh Sharma",Better Capital,
Flexmoney,FinTech,Series A,4800000,Mumbai,"Flexmoney’s mission is to address the enormous digital credit market opportunity created by the disruption from e-commerce, EMI and BNPL checkout finance",2021,2015.0,Yezdi Lashkari,Pravega Ventures,
Fampay,FinTech,Series A,38000000,Bangalore,India's first numberless card and UPI without a bank account,2021,2019.0,"Kush Taneja, Sambhav Jain","Greenoaks Capital, Elevation Capital",
Apna,Human Resources,Series B,70000000,Bangalore,India's Professional App - Apna is dedicated to solving the problem of unemployment at the grassroot level,2021,2019.0,Nirmit Parikh,"Sequoia Capital India, rocketship.vc",
XYXX Apparels,Fashion,Series A,4000000,Surat,"XYXX Apparels,which runs an eponymous innerwear brand",2021,2017.0,Yogesh Kabra,,
WaterScience,D2C startup,,Undisclosed,Bangalore,The aim of making good water affordable and accessible.,2021,2014.0,Sudeep N,,
BrowserStack,Tech,Series B,200000000,Mumbai,BrowserStack is a leading software testing platform powering over two million tests every day across 15 global data centres.,2021,2011.0,"Nakul Aggarwal, Ritesh Arora",Accel,
Vital,Insuretech,Pre-series A,3000000,Delhi,"An affordable, digital health plan built around to cover both big and small expenses",2021,2018.0,Rahul Kumar,BLinC Invest,
Juicy chemistry,HealthTech,,Undisclosed,Coimbatore,Juicy Chemistry operates as an eponymous consumer brand.,2021,2014.0,"Megha, Pritesh Asher",Spring Marketing Capital,
Samaaro,Tech,,125000,Bangalore,"Samaaro is a virtual event platform designed to help organizations host scalable, secure, and effective virtual events for a global audience",2021,2020.0,"Mayank Banka, Purnank Prakash, Skandha Gopalan","Chaitanya Kalipatnapu, Kedar Gavane",
Imagimake,Innovation management,Pre-series A,500000,Mumbai,An innovative play system to help children create their imagination,2021,2011.0,"Disha Katharani, Ravi Kumar","Roha Investment Managers, angel investor Saumil Shah",
MSMEx,EdTech,Pre-series A,1000000,Andheri,MSMEx connects micro and small Business Owners with curated Business Experts over live video.,2021,2019.0,"Amit Kumar, Vishal Kumar, Dilip Kumar, Khushboo Arora, Kumar Sambhav","TNF Ventures, Razorpay",
RenewBuy,Insuretech,Series C,45000000,Gurugram,Simplest way to renew car insurance. Get quote and insure car in couple of minutes,2021,2015.0,"Balachander Sekhar, Sandeep Nanda","Lok Capital, IIFL Asset Management",
saarthi.ai,AI,Seed,Undisclosed,Bangalore,Multilingual Conversational Enterprise AI Platform for omnichannel automation of customer journeys in the user's native language.,2021,2017.0,"Piyush Dangaich, Sameer Sinha, Sangram Sabat, Vishwa Nath Jha",Nvidia Inception,
Kutumb,Community platform,Series A,26000000,Bangalore,Kutumb is a social community enabler.,2021,2020.0,"Mohit Sharma, Naveen Dewangan, Vipul Allawadhi","Tiger Global Management, DST Global",
Superplum,AgriTech,Pre-series A,3800000,Noida,Building India's most sophisticated platform for high quality fresh food,2021,2019.0,Shobhit Gupta,Marquee investors,
Upside AI,FinTech,Seed,1200000,Mumbai,Upside AI on the thesis that technology will make better investing decisions than humans over the long term.,2021,2017.0,"Kanika Agarrwal, Nikhil Hooda, Atanuu Agarrwal",Endiya Partners,
PazCare,Insuretech,,Undisclosed,Bangalore,Paz Care is India's leading Employee Benefits & Health insurance platform,2021,2021.0,Sanchit Malik,"Ashish Hemrajani, Parikshit Dar",
Answer Genomics,HealthTech,,Undisclosed,Bangalore,A healthcare company that uses genome-based data to help individuals make decisions.,2021,2019.0,Rahul Ranganathan,"India Accelerator, Lyxel&Flamingo",
Skillmatics,EdTech,Series A,6000000,Mumbai,Skillmatics develops learning games for pre-school and primary school kids aged under 10,2021,2016.0,Dhvanil Sheth,Sequoia Capital India,
Bimaplan,Insuretech,Pre-series A,2500000,Bangalore,Affordable insurance for the next billion Indians,2021,2020.0,Vikul Goyal,"Roshan Abbas, Ritesh Malik",
Bueno Finance,FinTech,Seed,3000000,Gurugram,"Bueno Gig Growth Technologies Pvt Ltd (""Bueno Finance"") is a financial services platform which aims is to help improve the financial health of customers.",2021,2019.0,"Saurav Gandhi, Sandeep Arora","Goat Capital, JAM Fund",
CityMall,E-Commerce,Series B,22000000,Gurugram,CityMall is a social e-commerce platform that sells lifestyle and curated products via peer-to-peer referrals on WhatsApp.,2021,2019.0,"Angad Kikla, Naisheel Verdhan","General Catalyst, Jungle Ventures",
BYJU’S,EdTech,,50000000,Bangalore,BYJU'S is an educational technology company that develops personalized learning programs for K-12 students.,2021,2011.0,"Byju Raveendran, Divya Gokulnath","Blackstone Group, ADQ",
India Quotient,Venture capitalist,,64000000,Mumbai,India Quotient is a new type of early stage investor. We fund companies building disruptive businesses aimed at Indian consumers. We're,2021,2012.0,"Anand Lunia, Madhukar Sinha",,
