Company/Brand,Sector,Stage,Amount($),HeadQuarter,What it does,Year,Founded,Founders,Investor,Subsector
Ergos,AgriTech,,4598000,Bangalore,It enables farmers to digitise their foodgrain and also provide access to supply chain solutions,2020,,"Kishor Jha, Praveen Kumar",Aavishkar Capital,
Nykaa,E-Commerce,,13137000,Mumbai,Deals in cosmetic and wellness products,2020,2012,Falguni Nayar,Steadview capital,
Samadhan,Insurance,Seed,Undisclosed,Delhi,They help find solutions to insurance related issues,2020,2018,"Deepak Bhuvneshwari Uniyal, Shilpa Arora, Shailesh Kumar, Sanjay Aggarwal",Venture Catalysts,
SaScan,HealthTech,,Undisclosed,Bangalore,Cancer diagnostics startup,2020,,Subhash Narayanan,Unicorn India ventures,
Lido Learning,EdTech,,3000000,Mumbai,Online teaching service,2020,,Sahil Sheth,"Pecus Capital, Madhur Deora",
CureFit,Health and Fitness,Series D,115000000,Bangalore,"Integrated platform for food, fitness and meditation.",2020,2016,"Mukesh Bansal, Ankit Nagori",Temasek,
Nimesa,Tech,,Undisclosed,Bangalore,Cloud data managemnt solutions enterprise,2020,2018,"Tapesh Goyal, Rajesh Vaidhyanathan",Ideaspring capital,
Design X,AI,Seed,200000,Noida,Builds IoT based products,2020,,Preet Arjun Singh,ThinkNext LLC,
Driftly Electric,Automotive,,Undisclosed,Bangalore,Electric vehicle startup,2020,,Sneha Roy,MG Motor India,
Imstrong,Fitness,Seed,400000,Bangalore,It is an online and live video-streaming platform that allows trainers and fitness enthusiasts to connect and engage in interactive online classes.,2020,2019,"Dilip Kumar, Selvan Thamarai, Deepti Nair",Rainmatter,
Craftsvilla,Marketplace,,3900000,Mumbai,Online marketplace for ethnic wear,2020,,Monica Gupta. Manoj Gupta,Supera Investments,
Rupifi,FinTech,Pre-seed,Undisclosed,Bangalore,Offers financial products for SMEs,2020,2020,"Anubhav Jain, Ankit Singh, Jawaid Iqbal","Ashneer Grover, Kunal Shah, Ramakant Sharma",
SnackAmor,Foodtech,Seed,Undisclosed,Mumbai,It offers various healthy snacks,2020,,Deepak Grover,Undisclosed,
Zealthy,HealthTech,Seed,Undisclosed,Bangalore,"It connects women to healthproviders for specialities like infertility, maternity etc.,",2020,2019,"Rishi Malhotra, Akhil Gupta","KYT Ventures, First Cheque, AngelList",
CoinDCX,FinTech,Series A,3000000,,A cryptocurrency trading platform,2020,,Sumit Gupta,"Polychain Capital, Bain Capital Ventures, HDR Group",
NuNu TV,Media,,670000,,Kids-focussed Youtube channel,2020,,,Risers Accelerators,
QTalk,Tech,Seed,1600000,Bangalore,Smart Phone Dialer,2020,,"Sagar Modi, Advaith Vishwanath","Accel India, Lightspeed Venture Partners",
Shadez,Interior & decor,Seed,100000,Mumbai,Paint Company,2020,2018,"Adarsh Anand, Amit Tiwari",Inflection Point Ventures,
Excess2Sell,E-Commerce,,1000000,Mumbai,B2B Marketplace for Overstock & Surplus Inventory,2020,,Rajan Sharma,Gautham Madhavan,
Stanplus,HealthTech,Pre-series A,1500000,Hyderabad,Ambulance service,2020,2016,Prabhdeep Singh,Pegasus FinInvest,
Pitstop,Automotive,Series A,2500000,Bangalore,Doorstep car service,2020,,Mihir Mohan mishra,TPG-backed Group Landmark,
Univariety,EdTech,,1100000,Hyderabad,Online marketplace that provides career counselling and college guidance,2020,2015,Jaideep Gupta,Info Edge,
Peel Works,Tech,"Series C, D",42.23000,Mumbai,E-commerce for corner/retail stores.,2020,2010,"Sachin Chhabra, Nidhi Ramachandran",CESC Ventures,
CoreStack,Tech,Series A,8500000,Chennai,Enterprise cloud governance technology startup,2020,2016,"Ezhilarasan Natarajan, Sabapathy Arumugam, Krishnakumar Narayanan, Thiruvalluvar NB",Naya Ventures,
Vivriti Capital,FinTech,Series B,50000000,Chennai,Digital lending startup,2020,2017,"Gaurav Kumar, Vineet Sukumar",LGT Lightstone Aspada,
Agnikul,Spacetech,Pre-series A,3148000,Chennai,"It designs, fabricates, tests and launch orbital class launch vehicles",2020,,Srinath Ravichandran,pi Ventures,
Fintso,FinTech,,2600000,,Wealth management platform,2020,2020,"George Mitra, Rajan Pathak","Rajeev Juneja, Pratul Shroff, Dilip Khandelwal, Piyush Gupta",
Khatabook,FinTech,,Undisclosed,Bangalore,It helps SMEs to maintain their accounts and ledger online.,2020,,Ravish Naresh,Mahendra Singh Dhoni,
Smart Coin,FinTech,Series A,7000000,,Consumer lending startup,2020,2015,"Amit Chandel, Rohit Garg, Vinay Kumar, Jayant Upadhyay",LGT LightstoneAspada,
ZunRoof,Cleantech,Series A,3000000,Gurugram,"It specialises in solar rooftop design, installation, and management using technology",2020,2016,"Pranesh Chaudhary, Sushant Sachan",Godrej Investments,
Shop101,Social e-commerce,Series C,3900000,,Enables entrepreneurs to sell online,2020,2015,"Abhinav Jain, Aditya Gupta","Stellaris Venture Partners, Unilever Ventures, Kalaari Capital, Vy Capital",
OM Bhakti,FMCG,Seed,Undisclosed,Bangalore,A puja cotton-wicks manufacturing startup,2020,,"Sridhar Joshi, Prashant Kulkarni",Venture Catalysts,
Lal10,B2B,,1100000,Uttar Pradesh,It helps Indian artisans and SMEs reach out to global retailers,2020,2016,"Maneet Gohil, Sanchit Govil, Albin Jose",Sorenson Impact,
Anaxee Digital Runner,Tech,,Undisclosed,Indore,A tech-enabled ID verification and data collection startup,2020,2016,"Govind Agrawal, Arti Agrawal",Orios Venture Partners,
CollegeKhabri,EdTech,,Undisclosed,Bhopal,Platform is an end-to-end college and career counselling platform for students,2020,2019,Arshi Khan,Vishal Dixit,
Ola Electric,eMobility,,1000000,Bangalore,Electric vehicle,2020,,"Ankit Jain, Anand Shah",Pawan Munjal Family Trust Fund,
Multi Living,Real Estate,,6000000,Mumbai,"It curates apartments from the homeowners, performs the quality check and offers the homes with built-in services to the potential tenants",2020,,Pankaj Singh,Lodha Ventures,
FamPay,FinTech,Seed,4700000,Bangalore,"It allows parents to send money to their kids below the age of 18, which they can spend securely under parent supervision.",2020,,Kush Taneja,"Y Combinator, Venture Highway, Sequoia India, Global Founders Capital",
UnboxRobotics Labs,Automation tech,Seed,500000,Bangalore,Automated flexible parcel sorting solutions for logistics providers,2020,,Pramod Ghadge,"Arali Ventures, CIIE.CO",
Karbon Card,FinTech,Seed,2000000,Bangalore,Specialisde corporate cards for startups,2020,,"Pei-fu Hsieh, Amit Jangir","Kunal Shah, Amrish Rau, Jitendra Gupta",
Airmeet,Media & Networking,,3000000,Bangalore,"A platform to host, discover, and attend fully remote events like conferences and professional meet-ups",2020,,"Lalit Mangal, Vinay Jaasti, Manoj Singh",Accel India,
Innerchef,FoodTech,,1000000,Gurugram,Cloud kitchen platform,2020,,Rajesh,Mistletoe,
Epigamia,FMCG,Series C,2558000,Mumbai,Flavoured and greek yoghurt brand,2020,2015,Rohan Mirchandani,KA Enterprise,
StyleNook,E-Commerce,,Undisclosed,Mumbai,Marketplace for fashionable apparel,2020,,Lathika Pai,"Lead Angels Network, Stanford Angels",
Callido Learning,EdTech,,Undisclosed,Mumbai,Provides a structured educational approach to critical thinking and problem solving skills,2020,,Sriram Subramanian,Education Catalyst Fund,
Soxytoes,E-Commerce,,Undisclosed,Delhi,Online store to buy various types of socks including funky and colorful socks,2020,,"Vidushi Kajaria, Aayush Goenka",Angel network,
F5,E-market,Seed,Undisclosed,Delhi,Retail Aggregator,2020,2018,"Raghav Arora, Lalit Kumar Aggarwal",LetsVenture investors,
Paper Boat,Food and Beverages,,4049500,Bangalore,Ecommerce platform for beverages and snacks,2020,2013,"Neeraj Kakkar, James Nutall, Suhas Misra, Neeraj Biyani","Advent Management, A91 Emerging Fund, Trifecta Venture",
Strata,Proptech,Seed,1500000,Bangalore,Real estate investment platform,2020,2019,"Sudarshan Lodha, Priyanka Rathore","SAIF Partners, Mayfield India",
Salesken,AI & Data science,Series A,8000000,Bangalore,Provides sales professionals with intelligence on various aspects of the sales pitch,2020,,"Sreeraman Vaidyanathan, Surga Thilakan",Sequoia Capital India,
Arya,AgriTech,Series B,6000000,Noida,Provides post-harvest services across the agricultural value chain,2020,,Prasanna Rao,LGT Lightstone Aspada,
Leap Finance,FinTech,,5500000,Bangalore,Provides education loans to students based on the student’s future income,2020,,"Vaibhav Singh, Arnav Kumar",Sequoia Capital India,
Sleepy Owl,Beverages,,Undisclosed,Delhi,"It sells ready to drink cold brew coffees, brew boxes and packs.",2020,2016,"Ajai Thandi, Arman Sood, Ashwajeet Singh",Rukam Capital,
Tricog,HealthTech,Series B,10500000,Bangalore,Provides virtual cardiology services through its AI-powered healthcare platforms,2020,2015,"Charit Bhograj, Zainul Charbiwala, Udayan Dasgupta, Abhinav Gujjar","UTEC-The University of Tokyo Edge Capital, Aflac Ventures, LLC, Dream Incubator, TeamFund",
GogoBus,Travel tech,,Undisclosed,Delhi,Inter-City Mobility Startup,2020,,Amit Gupta,Ixigo,
Trell,Social e-commerce,Pre-series A,4000000,Bangalore,Allows users to share their travel experiences,2020,2016,"Pulkit Agrawal, Prashant Sachan, Arun Lodhi, Bimal Kartheek Rebba, Nirav Sheth","Sequoia’s Surge, Fosun RZ",
Spaciya Consultants,Real Estate,Pre-series A,500000,Noida,Real estate consultancy firms,2020,,Ajit Panda,Alok Garg,
Bounce,Automotive and Rentals,,6500000,Bangalore,Offers a variety of bikes and scooters that can be rented on a subscription basis,2020,2014,"Vivekananda Hallekere, Anil Giri Raju, Arun Agni",InnoVen Capital,
Neeman,E-Commerce,Pre-series A,1000000,,An eco-conscious footwear brand making comfortable shoes using Merino Wool,2020,2017,"Taran Chhabra, Amar Preet Singh",Anicut Angel Fund,
Chqbook,FinTech,Series A,5000000,Gurugram,"Marketplace for small business owners, offering them products around lending, credit cards etc",2020,2017,"Vipul Sharma, Rajat Kumar, Sachin Arora, Mohit Goel",Aavishkaar Capital,
SMEcorner,FinTech,Series B,30000000,Mumbai,Financial lending firm to SMEs,2020,2014,"Bhatia, Sneha Shah",Paragon Partners,
Oda Class,EdTech,Pre-series A,Undisclosed,Bangalore,"It offers content and material via video, adopting a dual-teacher model with IIT and NIT alumni",2020,,"Li Yong, Shushant Srivastava",Yuanfudao,
Spinny,E-tail,Series B,43700000,Haryana,Used car retailing platform,2020,2015,"Niraj Singh, Mohit Gupta, Ramanshu Mahuar","Nandan Nilekani, Sanjeev Aggarwal",
goStops,Accomodation,,Undisclosed,Delhi,A premium chain of youth hostels catering to the millennials,2020,2012,"Pallavi Agarwal, Pankaj Parwanda",Atraxn Partners.,
Umeed Housing,FinTech,Series D,23000000,Haryana,Housing finance company,2020,,Ashutosh Sharma,Morgan Stanley Private Equity Asia,
Vogo,Automotive,Series C,20000000,Bangalore,A scooter-sharing platform allowing users to rent a two-wheeler from specific designated pick up points,2020,2016,"Anand Ayyadurai, Padmanabhan Balakrishnan, Sanchit Mittal",Lightstone Aspada,
Flick Stree,AI & Media,Series A,3000000,Mumbai,Artificial intelligence-based video publishing network,2020,,Saurabh Singh,Samsung Venture Investment,
Qure ai,HealthTech,,16000000,Mumbai,Provides interpretations of radiology scans,2020,2016,"Prashant Warier, Pooja Rao",Sequoia Capital India,
MinionLabs,Machine Learning,,Undisclosed,Bangalore,It leverages a Machine Learning-based approach to generate a comprehensive report on predictive analytics,2020,,Gokul Shrinivas,Indian Angel Network,
Josh Talks,Media,Pre-series A,1500000,Haryana,Community of young individuals providing a platform to showcase their stories,2020,2015,"Supriya Paul, Shobhit Banga",Media Development Investment Fund,
PhoneParLoan,FinTech,,Undisclosed,Delhi,Provides easy loans,2020,2015,Ringaile Noq,Accelerator MOX,
RailYatri,Travel,,13800000,Noida,A complete Indian railways app,2020,2011,"Manish Rathi, Kapil Raizada, Sachin Saxena","Nandan Nilekani, Samsung Venture Investment Corporation",
AjnaLens,Deeptech,Pre-series A,1500000,Thane,"It leverages technologies such as AR, VR & AI to offer hardware in areas such as education and defence",2020,2014,"Pankaj Raut, Abhishek Tomar, Abhijit Patil","Maharashtra Defence, Aerospace Venture Fund (MDAVF)",
Pepper,Content Marktplace,Seed,306900,Mumbai,End to end content creation platform,2020,2017,Anirudh Singla and Rishabh Shekhar,"Kunal Bahl, Rohit Bansal",
Rupeek,FinTech,,30000000,Bangalore,An asset backed online lending platform,2020,2015,"Amar Prabhu, Ashwin Soni, Sumit Maniyar","GGV Capital, Bertelsmann India Investments, Binny Bansal, Sequoia India, Accel Partners",
iMerit,InfoTech & Services,Series B,20000000,Kolkata,Turns information into data that is usable for machine learning processes,2020,2012,Radha Basu,CDC Group Plc,
BharatPe,FinTech,Series C,75000000,Delhi,Digital payments platform,2020,2018,Ashneer Grover,Ribbit Capital,
Invideo,Visual Media,,2500000,,Video production and editing platform,2020,,Sanket Shah,Sequoia Capital’s Surge,
AvalonMeta,EdTech,,420000,,It combines higher education and competitive gaming,2020,2017,"Varun Mayya, Shashank Udupa, Abhinav Arora",Peerplays,
Near Store,E-Commerce,Seed,300000,Mumbai,Enables a shop to create an online presence,2020,,,Sauce.vc,
ElecTorq,Automotive,,Undisclosed,Delhi,Electric vehicle startup,2020,,Anubhav Sharma,AdvantEdge,
Prayaan Capital,FinTech,Seed,1200000,Chennai,"NBFC that lends to micro, small, and medium-sized enterprises (MSMEs)",2020,,"Madhan Mohan , Akash Chelvam",Accion Venture Lab,
Sanfe,Hygiene,Pre-series A,1100000,Delhi,Women health care and wellness product,2020,,"Archit Agarwal, Harry Sehrawat","SucSEED Venture Partners, BIRAC, Elixir Pharma, Titan Capital",
Go Desi,FoodTech,Seed,627300,Delhi,Provides traditional delicacies,2020,2018,Vinay Kothari,Rukam Capital,
Swiggy,FoodTech,Series A,113000000,Bangalore,Platform to order food online from restaurants and getting it delievered,2020,2014,"Nandan Reddy, Sriharsha Majety, Rahul Jaimini",Prosus N.V,
Whatfix,Tech,Series C,32000000,Banglore,"Digital adoption platform that helps companies provide intuitive onboarding, training and support",2020,2014,"Khadim Batti, Vara Kumar",Sequoia Capital India,
Unacademy,EdTech,Series E,110000000,Bangalore,Platform that offers online education in India,2020,2010,"Gaurav Munjal, Roman Saini, Hemesh Singh","Facebook, General Atlantic, Sequoia India, Nexus Venture Partners, Steadview Capital, Blume Ventures",
Zvesta,Proptech,,5500000,Gurugram,An online platform where users can search and buy properties listed by developers and brokers,2020,2015,"Rajan Dang, Anushree Srivastava",Hindustan Media Ventures,
Dunzo,Logistics,,11000000,Bangalore,India-based hyperlocal delivery startup,2020,2014,Kabeer Biswas,Alteria Capital,
Digit Insurance,Insurtech,,340000,Bangalore,General Insurance Company,2020,,Kamesh Goyal,"Virat Kohli, Anushka Sharma",
Yolo,Transport,Seed,600000,Gurugram,Intercity transportation,2020,2019,"Shailesh Gupta, Mukul Shah, Danish Chopra",Undisclosed,
SmartVizX,VR & SaaS,Pre-series A,1397000,,It developed India’s first VR-based design communication and collaboration product Trezi,2020,2015,"Tithi Tewari, Gautam Tewari",Rockstud Capital,
MaxWholesale,E-Commerce,Series A,3000000,Delhi,B2B ecommerce platform for kirana stores,2020,2016,Samarth Agrawal,"IAN Fund-I,  Al Falaj Investment Company (AFI)",
Carbon Clean,Cleantech,,16000000,,Develops affordable carbon capture technology,2020,2009,"Aniruddha Sharma, Prateek Bumb","WAVE Equity Partners, Chevron Technology Ventures, Marubeni Corporation.",
Onsitego,Sales & Services,Series B,19000000,,It offers post-purchase services through a network of brand authorised service centres throughout the country,2020,,Mahipal,Zodius Growth Fund,
Genius Corner,EdTech,,250000,Noida,Framework to enable personalised learning using artificial intelligence (AI) and machine learning (ML).,2020,2014,"Vishal Khatter, Dheeraj Khatter, Dipak Varshney","Mahesh Mohta, Jyoti Arora, Nachu Subramanian, Srivats",
PlanetSpark,EdTech,,448500,Gurugram,Provides neighbourhood learning zones where children learn and develop 'new-age' skills under one roof,2020,2016,"Maneesh Dhooper, Kunal Malik","Indian Angel Network, Lead Angels, Hyderabad Angels",
CamCom,AI & Deep learning,,Undisclosed,Bangalore,AI automation platform for enterprise quality control,2020,2017,"Ajith Nayar, Umesh, Mahesh Subramanian","Triton Investment Advisors,",
Simsim,Social Commerce,Series B,8000000,Bangalore,It enables community opinion influencers to sell products to thousands of micro-communities in India,2020,,Amit Bagaria,"Accel Partners, Shunwei Capital, Good Capital",
Shuttl,Transport,Series C,7975700,Delhi,App based bus aggregator serice,2020,2015,"Amit Singh, Deepanshu Malviya",SIG Global India Fund,
HooLiv,Housing & Rentals,,Undisclosed,Delhi,Student Co-living startup,2020,,"Chinmoy Mishra, Gaurav Vij, and Abhishek Verma",Kolte-Patil Family Office,
ClassMonitor,EdTech,,Undisclosed,Indore,The learning platform that blends curriculum-based activities for children,2020,,"Vijeet Pandey, Vikas Rishishwar",Ashwin Khorana,
Friyey,Co-working,,Undisclosed,Pune,Co working space startup,2020,,Yogesh Thore,Tarun Bhalla,
Oga,Fitness,,330000,Bangalore,Provides interactive fitness experience to people across the world,2020,,Ashish Rawat,Inflection Point Ventures,
Big Basket,Estore,,3500000,Bangalore,Online grocery store,2020,,"Abhinay Choudhari, Hari Menon, Vipul Parekh, VS Sudhakar",Trifecta Capital,
CYFIRMA,Tech,Series A,Undisclosed,Bangalore,Offer cybersecurity services,2020,,Ritesh Kumar,Z3 Partners,
Innoviti,,,5000000,Bangalore,Digital payments solutions company,2020,,Rajeev Agrawal,FMO,
Paytm money,FinTech,,5600000,Bangalore,Wealth Management,2020,2010,Vijay Shekhar Sharma,One97 Communications,
Vedantu,EdTech,Series C,24000000,Bangalore,Onine learning platform,2020,,"Saurabh Saxena, Pulkit Jain, Anand Prakash, Vamsi Krishna",GGV Capital,
Yap,FinTech,,1402000,Chennai,Banking and payment products-focused API platform,2020,,"Madhusudanan R, Muthukumar and Prabhu","Amrish Rau, Kunal Shah, Jitendra Gupta",
Clover,AgriTech,Series A,5500000,Bangalore,Provides agricultural solution to farmers working in the greenhouse production of vegetables and fruits,2020,,"Avinash BR, Gururaj Rao, Arvind Murali, Santhosh Narasipura","Omnivore, Accel Partners, Mayfield",
Nova Credit,FinTech,Series B,50000000,,Cross-border consumer credit startup,2020,,Nicky Goulimis,"Kleiner Perkins, Canapi Ventures, Index Ventures, Nyca Partners, General Catalyst.",
CodingNinjas,EdTech,Series A,5200000,Delhi,Online learning platform,2020,2016,"Singla, Kannu Mittal, Dhawal Parate",Info Edge Ltd,
Furlenco,E-Commerce,Series C,2200000,Bangalore,Furniture rental startup,2020,2011,Ajith Mohan Karimpana,Chowdry Associates,
Brick&Bolt,,Pre-series A,1500000,Bangalore,Operates in the residential construction space,2020,2018,"Jayesh Rajpurohit, Arpit Rajpurohit",Surge,
HempStreet,HealthTech,Pre-series A,1000000,,Manufacturer of ayurvedic medicines based on cannabis,2020,2019,Abhishek Mohan,Pharmacon Holdings,
MoEngage,Marketing,Series C,25000000,Bangalore,Customer analytics and cross-channel engagement platform,2020,,"Raviteja Dodda, Yashwanth Kumar",Eight Roads Ventures,
Classplus,EdTech,Pre-series A,2500000,,It allows coaching centres to take their brick-and-mortar setup online,2020,2018,"Rustagi, Bhaswat Agarwal","Blume Ventures, Sequoia",
Chaayos,Beverages,,21500000,,Provides customised range of tea,2020,2012,"Nitin Saluja, Raghav Verma",Think Investment,
PetPooja,Tech,,2000000,Ahmedabad,Restaurant management software provider,2020,2011,Apurv Patel,Udaan,
Altor,Tech,,Undisclosed,,Makes helmets that are IoT and AI enabled,2020,,"Shamik Guha, Sayan Tapadar, Muhammad Bilal Shakil, Anirban Datta Gupta",Venture Catalysts,
Pepperfry,E-market,Series F,40000000,Mumbai,Online home furniture marketplace,2020,2013,"Ambareesh Murty, Ashish Shah",Pidilite Industries,
FirstCry,E-market,Series E,296000000,Pune,Baby products marketplace,2020,2010,"Supam Maheshwari, Amitava Saha",Softbank’s Vision Fund,
Byju,EdTech,,200000000,,Provides online learning classes,2020,2011,Byju Raveendran,General Atlantic,
Waycool,AgriTech,Series C,32000000,Chennai,Food development and distribution services,2020,2015,Karthick Jayraman and Sanjay Dasari,LightBox Ventures,
WorkIndia,HR tech,,6000000,,An online and mobile-based platform that connects companies with blue collar employees.,2020,,Kunal Patil,Xiaomi,
Qyuki,Media,,3500000,Mumbai,Multi-channel broadcast network,2020,,"AR Rahman, Shekhar Kapur",Info Edge Venture Fund,
Leap India,AgriTech,Series B,30000000,Coimbatore,Agricultural warehousing and logistics company,2020,,Narain Karthikeyan.,Neev Fund,
Picxy,Media,,250000,Hyderabad,Stock photo industry,2020,,Jitendra Emmani,"FirstCheque, Angellist India, Aakrit Vaish, Ranjith Radhakrishnan",
Krimanshi,AgriTech,,20000,Jaipur,Sustainable system to feed animals by valorizing food residues and surplus into highly nutritious feeds,2020,,Nikhil Bohra,Arunachal Pradesh Social Entrepreneurship Meet,
NEETprep,EdTech,,Undisclosed,Delhi,Provides crash course for NEET preparation,2020,,Kapil Gupta,IndiaQuotient,
Dot Pvt. Ltd,FinTech,Seed,8000000,Gurugram,It provides digital transformation and commerce solutions to brick and mortar outlets,2020,,Shailaz Nag,"PayU, Fosun RZ Capital",
Kuku FM,Media,Series A,5500000,Mumbai,A podcast platform,2020,,"Lal Chand Bisu, Vikas Goyal, Vinod Kumar Meena",Vertex Ventures,
SuperMoney,FinTech,Pre-series A,1000000,Mumbai,Provides financial tools for effective business making,2020,2018,Nikhil Banerjee,Unitus Ventures.,
Rebel Foods,Food tech,,4900000,,It runs internet kitchen,2020,,"Jaydeep Barman, Kallol Bannerjee",Alteria Capital,
AlphaVector,E tailor,,Undisclosed,Bangalore,It sells modern age bicycles named FROG,2020,2015,Sachin Chopra,"Avaana Capital, Titan Capital",
Fox Capital,FinTech,,2500000,Jaipur,Digital lending startup,2020,2019,Rakesh Sharma,Institutional Investors,
Tribe Theory,Accomodation,,3500000,Bangalore,An entrepreneur-focused hostel chain present in multiple locations across the world.,2020,,Katie Russel and Daniel Wiegand,Tim Draper,
Fleetx,Tech,Series A,1402400,,Fleet management and predictive analytics platform,2020,,"Vineet Sharma, Abhay Jeet Gupta, Udbhav Rai, Parveen Kataria, Vishal Misra",Beenext,
Embibe,EdTech,,12618300,Mumbai,It provides AI-based data analytics to personalise learning outcomes,2020,,Aditi Avasthi,Reliance Industries Limited (RIL),
Entri,EdTech,Seed,1400000,Kochi,It is a app that provides different types of learning content in local languages,2020,2017,"Mohammed Hisamuddin, Rahul Ramesh",Good Capital,
Oye! Rickshaw,E-mobility,Series A,10000000,,App-based electric rickshaw hailing service,2020,,Akash Deep,Chiratae Ventures,
Seal Professional,EdTech,Pre-series A,Undisclosed,Bangalore,Trains students in managemnt and leadership skills and also helps in placement,2020,2012,,Equanimity Ventures,
Sprinng Foods,Foodtech,,Undisclosed,Mumbai,Provides Gluten-free food,2020,,Tarun Khanna,"Mistletoe, Info Edge Asia",
1MG,HealthTech,,9900000,Gurugram,Online pharmacy,2020,2015,"Prashant Tandon, Gaurav Agarwal, Vikas Chauhan",Bill & Melinda Gates Foundation,
Aagey,FinTech,,Undisclosed,Bangalore,Provides financial assistance to MSMEs,2020,,Akaash Shankar,"JITO Angel Network, Ketan Kothari, Girish Jain, Sunil Singhvi, Vinay Jain",
Doubtnut,EdTech,Series A,15000000,Gurugram,Multi-lingual digital solutions platform for students,2020,2017,"Tanushri Nagori, Aditya Shankar",Tencent,
AdonMo,Ad-tech,,3000000,Bangalore,It is an online and outdoor advertising company,2020,2017,"Sandeep Bommireddi, Sravanth Gajula",Ant Financial,
RACEnergy,E-mobility,Seed,Undisclosed,,It builds electric vehicles and supporting infrastructure,2020,2018,"Arun Sreyas, Gautham Maheswaran","GrowX ventures, Prophetic Ventures",
BharatPe,FinTech,,100000000,Delhi,Digital payments platform,2020,2018,Ashneer Grover,Coatue Management,
Kisan Network,AgriTech,Seed,3000000,Gurugram,Integrated supply chain for farmers to sell their produce directly to buyers,2020,2015,"Aditya Agarwalla, Sanjay Agarwalla",Atsushi Taira,
Vogo,Automotive,Series C,35000000,Bangalore,A scooter-sharing platform allowing users to rent a two-wheeler from specific designated pick up points,2020,2016,"Anand Ayyadurai, Padmanabhan Balakrishnan, Sanchit Mittal",Lightstone Aspada,
Yolo,Transport,Seed,600000,Gurugram,Intercity transportation startup,2020,2019,"Shailesh Gupta, Mukul Shah, Danish Chopra",Undisclosed,
Unotech,Tech,,2000000,Mumbai,It develops fully-customisable open source software,2020,2011,Vikash Jha,Manish Choksi,
Zetwerk,Marketplace,,2200000,Bangalore,B2B marketplace that connects manufacturing companies for industrial equipements,2020,2018,"Amrit Acharya, Srinath Ramakkrushnan, Vishal Chaudhary",InnoVen capital,
CureSkin,HealthTech,,500000,Bangalore,Provides a treatment solution for skincare and hair fall issues with an artificial intelligence-enabled solution,2020,2017,"Guna Kakulapati, Rama Rajanna, Charu Sharma",SenseAI Ventures,
WizKlub,EdTech,Seed Funding,982530,Bangalore,Helps students solve problems at complex level,2020,2018,Amit Bansal,Incubate Fund India,
Interviewbit,EdTech,Series A,200000000,Pune,Platform that provides coding and interview preparation course by industry professionals from tech companies,2020,2014,Abhimanyu Saxena,"Tiger Global Management, Sequoia Capital India, Singapore’s Economic Development Board (EBD)",
MoneyTap,FinTech,Series B,70185200,,App-based consumer credit line that gives customers access to credit on tap.,2020,2016,"Bala Parthasarathy, Anuj Kacker, Kunal Varma","Aquiline Technology Growth (ATG), RTP Global, Sequoia India",
Uniplatform Tech,Tech,,Undisclosed,Delhi,Runs real estate SaaS platform MultiplyMyLeads.com.,2020,2015,"Rohit Manghnani, Amit K Jaiswal, Iccha Manghnani","Frontline Strategy Finds, SucSEED Venture Partners LLP",
