Company/Brand,Sector,Stage,Amount($),HeadQuarter,What it does,Year,Founded,Founders,Investor,Subsector
Prolixr,Skincare startup,Seed,Undisclosed,Gurugram,A premium skincare brand committed towards building innovative skin care wellness.,2020,2018,"Aditya Sharma, Jayesh Hans","Alfa Ventures, Divij Bajaj",
Byju's,EdTech,,200000000,Bangalore,BYJU'S is an educational technology company that develops personalized learning programs for K-12 students.,2020,2011,"Byju Raveendran, Divya Gokulnath","Owl Ventures, Tiger Global Management",
DaMENSCH,E-Commerce,,6000000,Bangalore,DaMENSCH is a designer and seller of men's apparel.,2020,2018,"Anurag Saboo, Gaurav Pushkar","Whiteboard Capital, Matrix Partners India",
Country Delight,Food and Beverages,Series C,25000000,Haryana,Country Delight produces and distributes milk intended to provide good quality and unadulterated milk at doorstep.,2020,2015,"Chakradhar Gade, Nitin Kaushal","Orios Venture Partners, Matrix Partners India",
SignalX,AI,Seed,800000,Hyderabad,SignalX offers an artificial intelligence-powered SaaS platform,2020,2018,"Govind Balachandran, Zakir Wahab, Piyush Arora","9Unicorns, 3Lines VC, Hyderabad Angels",
Lancify,EdTech,,300000,Bangalore,Lancify is building the world's strongest young workforce,2020,2018,"Gowtham Sundaresan, Azan Barodawala","Techstars, Techstars Bangalore Accelerator",
Krimanshi,Biotechnology company,Seed,600000,Jaipur,Krimanshi aims to increase rural income by improving the productivity of Indian cattle with better quality feed.,2020,2015,Nikhil Bohra,"Rajasthan Venture Capital Fund, AIM Smart City",
Instoried,AI,Pre-series A,1000000,Bangalore,Instoried is an augmented writing platform which improves customer interest and engagement.,2020,2018,"Sharmin Ali, Sutanshu Raj","Venture Catalysts, SOSV",
PlayerzPot,Gaming startup,Series A,3000000,Mumbai,"Favorite fantasy cricket, football & kabaddi leagues online to win daily cash and prizes",2020,2015,"Yogesh, Mitesh Gangar",,
Instamojo,FinTech,,Undisclosed,Bangalore,"Instamojo is an on-demand payments platform that enables entrepreneurs to build, manage, and grow their business online.",2020,2012,"Aditya Sengupta, Akash Gehani, Harshad Sharma, Sampad Swain","BASE, Gunosy Capital",
Turtlemint,HealthTech,,30000000,Mumbai,Turtlemint has built Indian personalized insurance platform,2020,2015,"Anand Prabhudesai, Dhirendra Mahyavanshi, Kunal Shah","Nexus Venture Partners, Dream Incubator",
Arata,E-Commerce,Pre-series A,1000000,Delhi,Arata is an e-commerce site for beauty products and cosmetics.,2020,2017,"Dhruv Madhok, Dhruv Bhasin",DSG Consumer Partners,
MPL,Gaming startup,,5000000,Bangalore,Mobile Premier League is a skill-based eSports platform used to offer cash prizes while playing games.,2020,2018,"Sai Srinivas Kiran G, Shubham Malhotra","Pegasus Tech Ventures, Base Partners",
True Balance,FinTech,,28000000,Gurugram,True Balance is a digital wallet that enables users to access utility bill payment and other financial products.,2020,2014,"Cheolwon Lee, Jay Yi, Martin Lee","IBK Capital, SB Partners",
Thrive,FoodTech,Pre-series A,Undisclosed,Mumbai,"Thrive is all-in-one restaurant ordering suite for table ordering, pickup, and delivery with marketing in-built.",2020,2020,"Dhruv Dewan, Krishi Fagwani","Whiteboard Capital, Ahimsa Capital",
Kitchens Centre,Proptech,Pre-series A,Undisclosed,Delhi,Kitchens Centre offers turnkey solutions to cloud kitchens.,2020,2019,Lakshay Jain,"Jonathan Swanson, Ankush Gera",
Prescribe,HealthTech,,100000,Chennai,Provide online services to patients by leveraging WhatsApp.,2020,2019,Nived Narayanan,Titan Capital,
Nepra,CleanTech,Series C,18000000,Ahmedabad,NEPRA Resource Management provides waste management solutions in India.,2020,2006,Sandeep Patel,"Asha Impact, Aavishkaar Venture Capital",
inFeedo,Tech,,3200000,Gurugram,"inFeedo is a predictive people analytics company helping 300,000+ employees in 100+ companies make their voice feel heard and valued.",2020,2013,Tanmaya Jain,"Peyush Bansal, Ritesh Malik",
Shilpa Sciences,HealthTech,Pre-series A,Undisclosed,Bangalore,Shilps Sciences is a healthtech platform that claims to have solved gene editing by accelerating single gene cell applications.,2020,2014,Ashwin Lal,AngelList India,
Arzooo,Tech,,Undisclosed,Bangalore,"B2B retail tech platform transforming 300,000+ SMEs in electronics space with its flagship ""Go Store"" product",2020,2016,"Khushnud Khan, Rishi Raj Rathore","3Lines, Jabbar Internet Group",
MindTickle,SaaS platform,Debt Financing,100000000,Pune,MindTickle offers the industry's most comprehensive sales readiness solution for closing knowledge and skill gaps in customer-facing teams.,2020,2011,"Deepak Diwakar, Krishna Depura, Mohit Garg, Nishant Mungali","Canaan Partners, NewView Capital",
Krimanshi,Biotechnology company,Seed,600000,Jaipur,Krimanshi aims to increase rural income by improving the productivity of Indian cattle with better quality feed.,2020,2015,Nikhil Bohra,"Rajasthan Venture Capital Fund, AIM Smart City",
Slice,FinTech,Debt Financing,5000000,Bangalore,Slice is a card for first-time credit card users. They are inventing the future of finance for young Indians,2020,2016,"Deepak Malhotra, Rajan Bajaj","Better Capital, Gunosy",
Rapawalk,E-Commerce,Seed,300000,Bangalore,Rapawalk is an online brand that offers a personalized service of creating your own shoes.,2020,2017,"Kashif Mohammad, Aravind Maddireddy","Sanjay Ramakrishnan, Ravi Garikipati",
Oga Fit's,Fitness startup,Pre-series A,Undisclosed,Bangalore,The new-age home workout app that gives you an unmatched boutique digital fitness studio experience.,2020,2017,Ashish Rawat,9Unicorns,
LAVAL,Consumer Goods,Pre-series A,Undisclosed,Bangalore,"Laval Cosmetics, affordable makeup for all ages",2020,2016,"Shrishti, Prithika",Jazal Group,
Stride Ventures,Venture capitalist,,80000000,Delhi,Stride Ventures is a venture capital firm in India which aims to invest in innovative startups across the country.,2020,2019,Ishpreet Gandhi,Small Industries Development Bank of India,
BlackSoil,FinTech,,10000000,Mumbai,Blacksoil Advisory is an independent boutique advisory firm.,2020,2016,Ankur Bansal,,
Biocon,HealthTech,,15000000,Bangalore,"Biocon is a healthcare and technology, company focused on biotechnology.",2020,1978,Kiran Mazumdar-Shaw,Goldman Sachs,
Clientjoy,Tech,Pre-series A,800000,Gujarat,Client Management Software For Modern Agencies.,2020,2013,"Abhishek Doshi, Anupama Panchal, Shashwat Bhatt, Yash Shah","LetsVenture, Jyotsna Bapat",
Xpressbees,E-Commerce,,100000000,Pune,Xpressbees is an e-commerce logistics company that provides reliable logistics solutions to its partners.,2020,2015,"Amitava Saha, Supam Maheshwari","Alibaba Group, InnoVen Capital",
GalaxyCard,FinTech,Seed,Undisclosed,Gurugram,Mobile based Instant credit card. | Easiest way to get a credit card. Get one in 3 minutes,2020,2017,"Amit Kumar, Gunjeet Singh",India Accelerator,
Wellness Forever,HealthTech,,100000000,Mumbai,Wellness Forever is the one-stop destination for wellness,2020,2008,"Ashraf Biran, Gulshan Bakhtiani, Mohan Chavan","Poonawalla, Allana Group",
MoooFarm,AgriTech,Pre-seed,500000,Gurugram,MoooFarm is an information technology company that bridges the technology gap to help marginalized dairy farmers.,2020,2019,"Param Singh, Aashna Singh, Abhijeet Mittal, Jitesh Arora","Navus Ventures, Rockstart",
BitClass,PaaS startup,Seed,2000000,Bangalore,BitClass is a PaaS solution which helps teachers set up their independent live classes,2020,2020,"Gunjan Kejriwal, Utsav Tiwary","AET Japan, Figure Eight Investments, Waterbridge Ventures",
Gonuts,Entertainment,Seed,400000,Mumbai,Personalised Video shoutouts from favourite celebrity.,2020,2020,"Vinamra Pandiya, Mayank Gupta, Joji George","Sweta Rau, Archana Priyadarshini",
Uolo,EdTech,Seed,2000000,Bangalore,Uolo Technology is founded by paranoid parents who want to make a difference to preschool experience.,2020,2013,"Pallav Pandey, Ankur Pandey, Siddharth Singh","Rajul Garg, Purvi Capital",
Kirana King,Retail,Pre-series A,900000,Jaipur,"A revolutionary idea of standardization, digitization & centralization to traditional Grocery system.",2020,2014,Anup Kumar,Rajasthan Venture Capital Fund,
Jade Forest,Beverages,Seed,250000,Delhi,"NATURALLY THE BEST From zero artificial ingredients in our drinks to the way they make you feel, we bring you a bespoke range of natural mixers.",2020,,"Punweet Singh, Shuchir Suri",,
iKure,HealthTech,,Undisclosed,Kolkata,iKure is a social enterprise that delivers primary healthcare and wellness & prevention services to communities in India,2020,2010,Sujay Santra,"Ratan Tata, Inflection Point Ventures, Ankur Mittal",
FrontRow,EdTech,Seed,3200000,Bangalore,"Comprehensive courses, taught by idols.",2020,,"Mikhil Raj, Shubhadit Sharma, Ishaan Preet Singh","Lightspeed, Elevation, Deepika Padukone",
Reliance Retail,E-Commerce,,10000000,Mumbai,Reliance Retail Ventures Limited is a subsidiary company of Reliance Industries Limited.,2020,2006,Mukesh Ambani,"Abu Dhabi Investment Authority, GIC",
TUBBR,Media,,Undisclosed,"Frisco, Texas, United States",World's First Personal Social Network,2020,2019,"Saurabh Uttam, Ravi Singhal",Global Ascent Partners,
Ather Energy,Automobiles,Series D,35000000,Bangalore,Ather Energy is a manufacturer of electric scooters.,2020,2013,"Arun Vinayak, Swapnil Jain, Tarun Mehta",HeroMotoCorp Ltd and Sachin Bansal,
Routematic,Tech,,2000000,Bangalore,Vision is to enable a safer and more comfortable commute to work for employees of India Inc.,2020,2007,"Sriram Kannan, Surajit Das","VAMM Ventures, Naresh Malhotra",
LivFin,FinTech,,4700000,Delhi,LivFin is a non-banking financial company registered with the Reserve Bank of India (RBI),2020,2017,Rakesh Malhotra,"DEG, KFW DEG",
Universal Sportsbiz Pvt Ltd,Fashion startup,,Undisclosed,Bangalore,A fashion startup based in Bengaluru.,2020,2012,Anjana Reddy,"Accel, Alteria Capital",
Lattu Kids,EdTech,,Undisclosed,Mumbai,Lattu kids is an edutainment platform for preschool kids.,2020,2017,Vivek Bhutyani,Mumbai Angels Network,
Eggoz,Food & Bevarages,Pre-series A,1500000,Indore,"Eggoz is a brand of fresh and chemical-free eggs, produced in tech-enabled & nutrition-engineered deep integration partnership with farmers.",2020,2016,"Abhishek Negi, Aditya Singh, Pankaj Pandey, Uttam Kumar","AVANA Capital, Rebright Partners",
Steradian Semiconductors,Deeptech,,Undisclosed,Bangalore,Semiconductor company focused on CMOS millimeter wave products for Radar.,2020,2016,"Gireesh Rajendran, Ashish Lachhwani, Apu Sivadas, Rakesh Kumar and Alok Joshi",Endiya Partners.,
CHARGE+ZONE,EV startup,Pre-series A,3000000,Gujarat,"Charge+Zone provides services in renewable energy solutions, product development, and software engineering company.",2020,2018,"Kartikey Hariyani, Pavan Bakeri",Mumbai Angels,
Stones2milestones,EdTech,Bridge,2000000,Gurugram,Stones2milestones is India (Delhi) Based EdTech Company,2020,2008,"Kavish Gadia, Nikhil Saraf","Menterra Venture Advisors, Emandi Sankara Rao",
Udacity,EdTech,Debt Financing,75000000,Outside India,"Udacity develops an online learning platform offering programs in artificial intelligence, machine learning, and robotics sector.",2020,2011,"David Stavens, Mike Sokolsky, Sebastian Thrun","Hercules Capital, Inc.Bertelsmann",
AjnaLens,AR/VR startup,Bridge,1000000,Thane,"AjnaLens develops AR/VR wearables primarily for the Defence, Education and enterprise customers.",2020,2014,"Abhijit Patil, Abhishek Tomar, Pankaj Raut","Mohsin Hani Al Bahrani, MoD",
Gully Network,E-Commerce,Pre-series A,1200000,Bangalore,Gully Network is a tech-enabled network of mid-sized grocery stores.,2020,2019,"Ajay Nain, Prateek Chaturvedi","CP Ventures, Orios Venture Partners",
TurboHire,Recruitment startup,Seed,1000000,Hyderabad,Talent Intelligence Platform for enterprises that helps recruiters discover the right candidates for a job using a Human-like AI,2020,2018,"Abhishek Kabra, Aman Gour","Kia Ora Ventures, Pentathlon Ventures",
Traya,HealthTech,Seed,Undisclosed,Mumbai,work with our customers closely to get their hair health sorted for long-term effective results,2020,,"Altaf Saiyed, Saloni Anand","Kae Capital, Whiteboard Capital",
Charcoal Eats,QSR startup,,2000000,Mumbai,"In the last five years, have served over 1.5 million orders and enjoy high customer satisfaction.",2020,2015,"Anurag Mehrotra, Krishnakant Thakur, Mohammed Bhol, Gautam Singh",Lokmat Investments,
Mitron TV,Video platform,,Undisclosed,Bangalore,Mitron is a free short videoplatform for next generation,2020,2020,"Shivank Agarwal, Anish Khandelwal",9Unicorns,
Svami,Food & Bevarages,,800000,Mumbai,Svami is the result of three seasoned drinkers extending their love for libations to the larger world of drinks.,2020,2016,Sahil Jatana,"Niren Shah, Rukam Capital Trust",
Dhurnia,EdTech,,100000,"Dhingsara, Haryana",Developer of an online learning platform intended for various competitive exam preparations.,2020,2018,"Ajay Kumar, Murari Singh","Chandigarh Angels Network, Modulor Capital",
Expertrons,EdTech,,Undisclosed,Mumbai,Expertrons is an AI video bot platform created to help students and professionals prepare for interviews.,2020,2019,Jatin Solanki,"Rohit Chanana, Sukanta Ganguly",
Leena AI,AI,,8000000,Outside India,Leena AI offers a human resource management platform that transforms employee experience with conversational AI.,2020,2015,"Adit Jain, Anand Prajapati, Mayank Goyal","Alan Patricof, Jim Moffatt",
Bizlog,Logistics,,1000000,Bangalore,Bizlog Value Chain enables re-commerce and circular economy through unique REVERSE LOGISTICS engine.,2020,2016,"HS Srinivasan, Krishnan Rajan, E.V. Shunmugam",IAN Fund,
Tamasha.live,Gaming,,300000,Mumbai,"Tamasha offers a platform for influencers to host live, video based, real money contests and games.",2020,2020,"Saurabh Gupta, Siddharth Swarnkar","9Unicorns, Titan Capital, FirstCheque",
Fedo,AI,,1000000,Bangalore,Artificial Intelligence based Credit Score for Health,2020,2017,"Arun Mallavarapu, Prasanth Madavana",AIM Smart City,
FabHotels,Hospitality,,1000000,Gurugram,Fabhotels is the online aggregator for hotel rooms. It aims to provide standardized services at economical budgets.,2020,2015,"Adarsh Manpuria, Vaibhav Aggarwal","RB Investments Pte. Ltd, Goldman Sachs",
Freshokartz,AgriTech,Pre-series A,1000000,Jaipur,"Freshokartz provides soil data based crop and fertilisers recommendation to farmers and delivery seeds, pesticides",2020,2016,"Chandrakanta, Rajendra Lora","Rajasthan Venture Capital Fund, Innovana Thinklabs",
FlexiLoans,FinTech,Debt Financing,6000000,Mumbai,"an online lending platform started with an endeavour to solve the problem that SMEs face in accessing Quick, Flexible and Adequate funds for growing their Businesses.",2020,2016,"Abhishek Kothari, Deepak Jain, Manish Lunia, Ritesh Jain",>Vikram Sud,
Agrix,AgriTech,,Undisclosed,Patna,"Farming-as-a-service (covering farm machinery and agri input services) and provides market linkages, especially for fragmented farm owners.",2020,2020,"Nilay Pandey, Saurav Singh, Vivek Kumar",Maple Capital Advisors,
BharatAgri,AgriTech,Pre-series A,Undisclosed,Pune,A Smart Farming Technology Platform for Indian Farmers,2020,2017,"Siddharth Dialani, Sai Gole","021 Capital, India Quotient",
FreshtoHome,E-Commerce,Series C,121000000,Bangalore,Freshtohome is an e-commerce platform for fresh and chemical-free seafood.,2020,2015,Shan Kadavil,"Ascent Capital, Iron Pillar",
Credable,FinTech,,4500000,Mumbai,CredAble provides working capital & supply chain finance programs for large enterprises and their suppliers and distributors.,2020,2017,Nirav Choksi,Oaks Asset Management,
Railofy,Transportation,Seed,5000000,Mumbai,Railofy is a WL & RAC protection that enables waitlisted passengers to reach their destination at the lowest possible price.,2020,2019,"Rohan Dedhia, Vaibhav Saraf, Hrishabh Sanghvi","Roots Ventures, Better Capital",
Finova Capital,FinTech,,55000000,Jaipur,Finova Capital is a non-banking financial company.,2020,2016,"Mohit Sahney, Sunita Sahney","Sequoia Capital India, Faering Capital",
Teachmint,EdTech,Seed,3500000,Bangalore,Teachmint is an easy to use platform for tutors to conduct unlimited live classes and manage their classrooms,2020,2020,"Mihir, Payoj Jain, Divyansh Bordia, Anshuman Kumar",Lightspeed India,
Peel-Works,E-Commerce,,3000000,Mumbai,Peel-Works is a tech and data analytics company specializing in e-commerce for corner stores.,2020,2010,"Sachin Chhabra, Nidhi Ramachandran","CESC Ventures, Brun Raschle",
Janani,Fertility tech,Pre-seed,200000,Bangalore,Janani aims to make the process of infertility treatment and assisted fertilisation easier,2020,2020,Nilay Mehrotra,9Unicorns,
Credgenics,FinTech,Seed,3300000,Gurugram,"Credgenics is a tech-enabled platform backed by Titan Capital, helping fintech lenders and Banks in their critical NPA reduction",2020,2018,"Anand Agrawal, Mayank Khera, Rishabh Goel","Accel, Sunder Nookala",
Finelistings,Luxury car startup,,Undisclosed,Delhi,A Used Luxury Car Marketplace,2020,2015,Aneesh Mathur,Justdial,
Wellversed,HealthTech,Pre-series A,Undisclosed,Delhi,Wellversed Health enables production of customised clinical food products specific to health requirements of a demography or an individual.,2020,2018,"Aanan Khurma, Aditya Seth, Ripunjay Chachan","KLUB Works, Shankar Narayanan",
Nykaa,Consumer Goods,,Undisclosed,Mumbai,Nykaa is an online marketplace for different beauty and wellness products.,2020,2012,Falguni Nayar,"Alia Bhatt, Katrina Kaif",
Jumbotail,E-Commerce,Series B2,11000000,Bangalore,"Jumbotail is solving an important problem of organising food and grocery ecosystem in India through technology, data science and design.",2020,2015,"Ashish Jhina, Karthik Venkateswaran",Nexus Venture Partners and 23 High Networth Individuals (HNIs),
Winzo,Gaming startup,,2000000,Delhi,WinZO is a mobile e-sports social gaming platform that offers monetary benefits and prizes to players.,2020,2018,"Paavan Nanda, Saumya Singh Rathore","Makers Fund, Courtside Ventures",
mCaffeine,Consumer Goods,Series B,5000000,Mumbai,"MCaffeine is a personal care brand that offers caffein-infused face, body, and hair care products.",2020,2015,"Tarun Sharma, Vikas Lachhwani","RPSG Ventures, Amicus Capital",
Pocket FM,FM,Series A,5000000,Bangalore,Pocket FM is an audiobook & podcast app that brings you over 10K+ popular audiobooks.,2020,2018,Rohan Nayak,"Times Group, Lightspeed",
Snackible,HealthTech,Bridge,Undisclosed,Mumbai,Snackible operates a health-food production company designed to sell healthy snack food via online and offline channels.,2020,2015,,"Mumbai Angels, Murali Nair",
FreshtoHome,E-Commerce,,16000000,Bangalore,Freshtohome is an e-commerce platform for fresh and chemical-free seafood.,2020,2015,Shan Kadavil,"Ascent Capital, Iron Pillar",
Jumbotail,Retail,Series B2,11000000,Bangalore,Jumbotail is solving an important problem of organising food and grocery ecosystem in India,2020,2015,"Ashish Jhina, Karthik Venkateswaran","Nexus Venture Partners, Capria Ventures",
Nykaa,E-Commerce,,Undisclosed,Mumbai,Nykaa is an online marketplace for different beauty and wellness products.,2020,2012,Falguni Nayar,"Katrina Kaif, Steadview Capital",
TagZ Foods,Foodtech,,Undisclosed,Bangalore,TagZ Foods is a supplier of snacks and food products.,2020,2019,"Sagar Bhalotia, Anish Basu Roy","Exfinity Venture Partners, Shesh Kondi",
Genius Teacher,EdTech,,2000000,Mumbai,"Genius Teacher creates engaging educational content, delivers fun learning experience to the students",2020,2016,"Advitiya Sharma, Gaurav Lahoti","Sandeep Tandon, Daniel Lapus",
Krimanshi Feeds,Nutrition sector,,500000,Jaipur,Krimanshi aims to increase rural income by improving the productivity of Indian cattle with better quality feed.,2020,2015,Nikhil Bohra,"Rajasthan Venture Capital Fund, AIM Smart City",
Origo,AgriTech,Debt Financing,4000000,Gurugram,Provider of marketing and warehousing services for agricultural commodities.,2020,2010,"Sunoor Kaul,",Northern Arc Capital,
GetVantage,FinTech,Seed,5000000,Mumbai,GetVantage is India and Southeast Asia's first fintech enabled Revenue-based financing platform.,2020,2019,"Amit Srivastava, Bhavik Vasa, Sachin Tagra, Sachin Tagra","Samyakth Capital, Venture Catalysts",
Betterplace,Tech platform,Series B,10000000,Bangalore,Developer of a digital verification platform designed to manage the semi-formal workforce.,2020,2015,"Saurabh Tandan, Pravin Agarwala",Jungle Ventures,
Biddano,HealthTech,Pre-series A,600000,Mumbai,India's 1st tech-enabled healthcare logistics platform.,2020,2016,Talha Shaikh,Windrose Capital,
InVideo,Video,Series A,15000000,Mumbai,InVideo enables you to transform your content into great videos.,2020,2017,"Harsh Vakharia, Pankit Chheda, Sanket Shah","Base Partners, Sequoia Capital India",
Arzooo,Retail Tech,Series A,7500000,Bangalore,"Retail tech platform empowering 300,000+ small retailers in electronics space to compete with big organised players and increase sales",2020,2016,"Khushnud Khan, Rishi Raj Rathore","3Lines, Jabbar Internet Group",
Hubilo,Tech,Seed,4500000,Outside India,World’s smartest virtual event platform that brings Experience & Intelligence together,2020,2020,"Mayank Agarwal, Vaibhav Jain","Nishant Rao, Jonathan Boutelle",
BASIC Home Loan,FinTech,Seed,5000000,Gurugram,"A platform for automating home loans for middle and low-income households in India,",2020,2020,Atul Monga,Picus Capital,
Ketos,AI,,18000000,"San Francisco, United States",KETOS provides hardware and software analytics solutions and real-time data for usage and flow across water systems.,2020,2015,Meena Sankaran,"Citi Ventures, Illuminated Funds Group",
SUGAR cosmetics,Consumer Goods,Debt Financing,2000000,Mumbai,It is a cruelty-free makeup brand providing cosmetics that is high on style and higher on performance.,2020,2012,"Kasuhik Mukherjee, Vineeta Singh","A91 Partners, RB Investments Pte. Ltd",
Signzy,FinTech,,5400000,Bangalore,It is creating 'building blocks for a Digital Trust system.,2020,2015,"Ankit Ratan, Ankur Pandey, Arpit Ratan","GenNext Ventures, Contrarian Drishti Partners",
Ahaguru,EdTech,Series A,Undisclosed,Chennai,"It is conducting IIT JEE Coach for Physics, Math and Chemistry easily.",2020,2012,"Gomathi S, Dr Balaji Sampath",Anand Mahindra,
Tekion,AI,Series C,150000000,"San Ramon, California",It is a cloud-built platform with advanced machine learning and AI capabilities for a personalized and seamless consumer experience.,2020,2016,"Guru Sankararaman, Jay Vijayan","Alliance Ventures, Storm Ventures",
Brighteye Ventures,EdTech,,5400000,"Paris, Ile-de-France, France",Education technology venture capital firm.,2020,2017,David guerin,Tandem,
EzeRx,Medtech,Seed,200000,Kolkata,Developer and manufacturer of medical devices,2020,2018,"Amit mandahar, Chaitali roy","Indian Oil Corporation, Krishna Chakravarty",
VitalTech,HeathTech,Seed,3000000,"Plano, Texas, United States","VitalTech is a develop technologies that empower patients to better care for their safety,",2020,2018,Anjan Panneer Selvam,Tech Mahindra,
Genius Teacher,EdTech,,2000000,Mumbai,"Genius Teacher creates engaging educational content, delivers fun learning experience to the students",2020,2016,"Advitiya Sharma, Gaurav Lahoti","Whiteboard Capital, VKG Ventures LLP.",
Ultraviolette Automotive,Automobiles,Series B,4000000,Bangalore,Ultraviolette Automotive is a technology startup working on electric two-wheelers and energy infrastructure.,2020,2014,"Narayan Subramaniam, Niraj Rajmohan",TVS Motor Company,
Tring,Media,,,Mumbai,"Tring is a celebrity engagement platform, for all occasions including birthday, anniversaries, get well soon messages.",2020,2019,"Akshay Saini, Rahul Saini, Pranav Chabhadia","Sujeet Kumar, Hemesh Singh",
Rare Planet,Retail startup,Pre-series A,400000,Kolkata,Rare Planet sells handicrafts made by local artisans.,2020,2015,"Ranodeep Saha, Vijay Kumar",Venture Catalysts,
GoodGamer,Gaming,Seed,2500000,Bangalore,GoodGamer is India's first Daily Fantasy Sports and true Esports gaming platform.,2020,2020,Charles Creighton,,
InnAccel,Medtech,Pre-series A,1500000,Bangalore,"A building a portfolio of novel medical devices designed, engineered, and priced for global Emerging Markets.",2020,2012,Siraj Dhanani,Mount Judi Ventures,
Tiliter,Retail,,7500000,Sydney,Software that uses computer vision to recognise products without barcodes,2020,2017,"Chris Sampson, Marcel Herz, Martin Karafilis","AngelList, Investec",
Slintel,Sles and marketing,,4200000,Outside India,"Slintel, a leader in capturing technographics-powered buying intent, helps companies uncover the 3% of active buyers in their target market.",2020,2016,"Deepak Anchala, Rahul Bhattacharya, Ranjana TN","Accel, Stellaris Venture Partners",
SoOLEGAL,LegalTech,,4000000,Delhi,"SoOLEGAL is a global integrated directory of lawyers, legal aid organizations, and Law firms.",2020,2015,Manish Kaul,,
HobSpace,EdTech,Seed,200000,Mumbai,India's Activity Hub for Kids,2020,2019,"Priya Goel Sheth, Harsh Jain",Artha Venture,
Supplynote,Tech,Seed,500000,Noida,Supplynote is India's leading procurement platform with a unique stack of SAAS and E-commerce to solve the procurement problem,2020,2015,"Abhishek Verma, Harshit Mittal, Kumar Kushang, Nitin Prakash","MOX, SOSV",
Hire Me Car,Car Service,Seed,Undisclosed,Noida,India's largest cloud based digital discovery and services provisioning platform for the taxi rental,2020,,Pankaj Sharma,,
ShopUp,E-Commerce,Series A,22000000,Bangaldesh,"ShopUp provides easy access to B2B sourcing, last-mile logistics, digital credit, and business management solutions to small businesses.",2020,2017,"Afeef Zaman, Ataur Rahim Chowdhury, Siffat Sarwar","Flourish Ventures, Lonsdale Capital",
